{
  "config_metadata": {
    "config_id": "ISS_CONSERVATIVE",
    "description": "Conservative regulatory regime - Strictest requirements",
    "version": "1.0.0",
    "collection_file": "Stables-HT-ISS-time-daily-5.json"
  },

  "jurisdiction": {
    "source": "inline",
    "inline": {
      "jurisdiction_code": "CONSERVATIVE",
      "jurisdiction_name": "Conservative Regulatory Regime",
      "backing_threshold": 1.1,
      "liquidity_threshold": 0.4,
      "wam_max_days": 45.0,
      "hqla_min_score": 100.0,
      "attestation_max_days": 7.0,
      "max_single_asset_share": 0.25,
      "hhi_warning_threshold": 0.2,
      "bank_stress_threshold": 0.3,
      "base_quality": 100.0,
      "quality_floor": 70.0,
      "sovereign_max_degradation": 0.15
    }
  },

  "market_scenario": {
    "source": "file",
    "file": "market-scenarios/baseline-normal.json"
  },

  "compliance_scenario": {
    "source": "file",
    "file": "compliance-scenarios/current-ops.json"
  },

  "simulation_timeframe": {
    "status_date": "2026-02-28T00:00:00",
    "start_date": "2026-03-01T00:00:00",
    "end_date": "2026-04-14T00:00:00",
    "frequency": "daily"
  }
}
